"created","screenName","text"
2015-05-31 03:38:01,"polititroms","Tromsø: Trafikkulykke. En personbil har kjørt av vegen ved flyplassen. Bilen kjørte igjennom gjerdet og havnet inne på flypl.området./2"
2015-05-31 03:33:19,"polititroms","Gisundbrua: Politiet har gjennomført fartskontroll på stedet. To bilførere anmeldt for fartsovertr. Førerkort beslaglagt."
2015-05-30 23:06:05,"polititroms","Sørkjosen: promillekontroll gjennomført i kveld. 40 bilførere kontrollert. Ingen reaksjoner fra politiets side."
2015-05-30 20:57:39,"polititroms","Tromsø: påtraff en mannsperson i 50 årene på Bjerkaker som var i besittelse av narkotika. Sak opprettet."
2015-05-30 20:53:09,"polititroms","Sørreisa: utforkjøring FV 86 ved nedkjøring til NATO kaia. Bilen ligger på taket. Vi er på stedet, ikke alvorlig personskade."
2015-05-30 15:51:06,"polititroms","Tromsø: En kvinne hadde behov for hjelp ned fra Jamnfjellet ifm Ti på Topp tur. Hentet ned ved hjelp av Norsk Folkehjelp."
2015-05-29 20:02:46,"polititroms","Tromsø/Krabbenes: bil i full fyr. Brann slokker i dette øyeblikk. Ikke meldt om personskade."
2015-05-29 19:57:56,"polititroms","Viser seg at fritidsbåten på ca 30 fot ligger i fjæra og brenner. Skal være et vrak av en båt som har ligget der en stund."
2015-05-29 19:13:34,"polititroms","Finnsnesrenna: melding om båt i brann. Redningsaksjon iverksatt."
2015-05-29 14:26:09,"polititroms","På stedet, brannen er nesten slukket. Mellom Fjordgårdtunnelen og gammelvegen hadde det tatt fyr i lyng, muligens grunnet avrevet strømkabel"
2015-05-29 13:42:10,"polititroms","Fjordgård, Senja: melding om lyngbrann. Skal ligge en strømførende kabel på vegen. Politi, brann og kraftselskap på vei utover."
