"created","screenName","text"
2015-06-11 05:57:38,"Hordalandpoliti","Nygård: politiet på stedet. Finner ikke biler som har vært involvert i trafikkuhell."
2015-06-11 05:45:58,"Hordalandpoliti","Nygård: trafikkuhell, 3 biler involvert. Trafikale problemer. Politiet er på vei."
2015-06-10 14:06:25,"Hordalandpoliti","Storavatnet, ein bil har køyrt utfor vegen. Ikkje alvorleg personskade, og trafikken flyt greitt forbi staden."
2015-06-10 13:44:45,"Hordalandpoliti","Storavatnet v/Terminalen. Trafikkulykke. Naudetatane er på veg mot staden."
2015-06-10 11:04:06,"Hordalandpoliti","Svaneviksveien: meldt om brann. Nødetater på stedet. Kraftig røykutvikling"
2015-06-10 08:24:41,"Hordalandpoliti","Litlesotra: meldt om bil som kjørte vinglete på Litlesotra. Bilen stanset like før Sotrabroen. Mistanke rus."
2015-06-10 08:05:13,"Hordalandpoliti","Knappskog: en person kjørt til lokal legevakt for sjekk, politiet avslutter på stedet. Sak opprettes"
2015-06-10 07:18:03,"Hordalandpoliti","Fløyfjellstunnelen sørgående: lastebil som har havarert. Bilberging på vei."
2015-06-10 07:11:19,"Hordalandpoliti","Knappskog: politiet på stedet. Trafikken flyter greit."
2015-06-10 06:56:10,"Hordalandpoliti","Knappskog: trafikkulykke, 2 biler involvert. Nødetater på vei."
2015-06-10 03:23:12,"Hordalandpoliti","Brannen er slukket, kontroll på stedet. En person er kjørt til Haukeland sykehus, en person er under behandling av helse på stedet"
2015-06-10 03:12:21,"Hordalandpoliti","Øvre Fyllingsveien: Meldt om brann i bolig, redningsetatene er ankommet stedet."
2015-06-10 01:10:06,"Hordalandpoliti","Skutevikstorget;Trafikkuhell, bil ligger på siden, fører er ute. Mistanke om promillekjøring, bilberging er rekvirert"
2015-06-09 18:06:47,"Hordalandpoliti","Grimseidvegen: Trafikkulykke ved Grimseidvatnet, Ein bil har køyrd ut. Vegen er førebels stengd på staden."
2015-06-09 12:31:36,"Hordalandpoliti","Florvåg: røykutvikling / gnister grunnet kortslutning i det elektriske anlegget."
2015-06-09 12:25:53,"Hordalandpoliti","Florvåg: politi og brannvesen på stedet, brann/gnister slukket. Kontroll på stedet"
2015-06-09 12:14:27,"Hordalandpoliti","Florvåg: meldt om røykutvikling i en lift ved Framo."
2015-06-09 10:06:18,"Hordalandpoliti","Kårtveit: antallet som var i båten er rettet til 4 personer. Alle til rette og alle i god behold."
2015-06-09 09:43:35,"Hordalandpoliti","Kårtveit: meldt kontroll på alle 5 personene. Alle blir fraktet til kaien på Kårtveit, alle skal være i god behold."
2015-06-09 09:19:04,"Hordalandpoliti","Kårtveit: rettelse: snakk om en båt som tar inn vann, 5 personer i båten, ingen i vannet pr nå."
2015-06-09 09:13:22,"Hordalandpoliti","Kårtveit/ Ågotnes: melding om 5 personer i vannet. Redningsetater på veg, samt Sea-King og luftamb."
2015-06-09 08:34:35,"Hordalandpoliti","Grimesvingene: melding om geiter i veien. Kjør forsiktig!"
2015-06-09 01:16:56,"Hordalandpoliti","Johannes Bruns gate: Mann på taket freistar å sparka inn ei dør, Politiet på staden.Fekk snakka mannen ned. Kontroll."
2015-06-09 00:50:23,"Hordalandpoliti","Edvard Griegs vei: Mannen har tent på en pizzaeske i busskur for å varme seg. Ikke fare for spredning, Mannen formant og dimmetert på stedet"
2015-06-09 00:42:58,"Hordalandpoliti","Edvard Griegs vei; Person forsøker å tenne på søppelspann. Politiet på stedet - kontroll på vedkommende."
2015-06-08 22:55:01,"Hordalandpoliti","Kl.0020 - Blekketrappene: Vedkomande kom frivellig ned til patruljane. Verta meldt for forstyrring av ro og orden."
2015-06-08 22:53:01,"Hordalandpoliti","Kl.0020 - Bleketrappene: Melding om mann som går på taka. Vart konstatert at det IKKJE var Carlson på taket, men ein rusa mann på 23 år."
2015-06-08 20:33:12,"Hordalandpoliti","Gullfjellet: Sea King har fått hentet ned personen. Blir fraktet Haukeland sykehus. Lettere skadet."
2015-06-08 19:19:18,"Hordalandpoliti","2100: Politiet mottok melding om person som var skadet etter fall på Gullfjellet. Luftambulansen er sendt til stedet. Person bevisst."
2015-06-08 15:20:19,"Hordalandpoliti","Fantoft: Mann viftet med en kniv foran to kvinner i midten av 20 årene. Ba dem ringe politiet. Politiet rykket ut - kontroll på mannen."
2015-06-08 13:19:03,"Hordalandpoliti","Kl 1508. Kuventrævegen: Trafikkulykke mellom scooter og bil. Lettere personskade på fører av scooter. Politi og ambulanse på staden."
2015-06-08 12:00:18,"Hordalandpoliti","Rosendal: viser seg at damen har falt, ikke påkjørt. Damen er kjørt til lokal legevakt."
2015-06-08 11:37:01,"Hordalandpoliti","Rosendal: melding om eldre dame som har blitt påkjørt av bossbil. Nødetater på vei til stedet. Ukjent skadeomfang."
2015-06-08 09:17:34,"Hordalandpoliti","Kolltveittunnelen vest, i rundkjøring: meldt om en stein som ligger i veibanen, kan komme brått på. Entreprenør på vei"
2015-06-08 07:56:21,"Hordalandpoliti","Olsviktunnelen: viser seg at fører ikke har førerkort til trekke hengeren. Sak opprettes. Politiet avslutter på stedet."
2015-06-08 07:33:48,"Hordalandpoliti","Olsviktunnelen: bil som har mistet tilhenger. Politiet på stedet. Ingen trafikale problemer."
2015-06-08 05:08:00,"Hordalandpoliti","Hesthaugveien: brannvesen på stedet, finner ingen bil i brann."
2015-06-08 05:03:52,"Hordalandpoliti","Hesthaugveien v/ Åsane terminal: meldt om bilbrann. Politi og brannvesen på vei til stedet."
2015-06-08 03:43:38,"Hordalandpoliti","Det har vore ei roleg natt for politiet i Hordaland. Me skulle gjerne hatt fleire slike; utan slagsmål, spetakkel eller alvorlege hendingar."
2015-06-07 17:43:24,"Hordalandpoliti","Fjell: En person involvert i ulykken, kjøres legevakt for sjekk, glatt på stedet, vts er varslet, inntauing av bilen er rekvirert"
2015-06-07 17:18:22,"Hordalandpoliti","Fjell: Trafikkulykke, en bil kjørt i fjellveggen, redningsetatene rykker ut"
2015-06-07 10:46:56,"Hordalandpoliti","Odda-Gryteskaret. Røde Kors kalt ut for å lokalisere/hente ned turgåer."
2015-06-07 10:45:01,"Hordalandpoliti","Hjelteryggen-brann. Mannen som er pågrepet er innsatt i varetekt."
2015-06-07 10:24:05,"Hordalandpoliti","Hordviktunellen: bilberging utført, men nordgående felt er fremdeles stengt pga teknisk feil. Entreprenør på veg til stedet."
2015-06-07 10:08:09,"Hordalandpoliti","Hordviktunellen stengt grunnet bil som står i løpet. Bergingsbil på veg. Førar til køar"
2015-06-07 10:04:28,"Hordalandpoliti","Hjelteryggen. Politiet har pågrepet en person mistenkt for å tenne på brannen i garasjeanlegget"
2015-06-07 09:35:55,"Hordalandpoliti","Hjleteryggen. Politi og brannvesen rykker ut til brann i garasjeanlegg"
2015-06-07 09:28:13,"Hordalandpoliti","Fantoft. Matlaging."
2015-06-07 09:18:22,"Hordalandpoliti","Fantoft.Politi og brannvesen rykker ut på automatisk brannalarm og melding om mulig røyk i en korridor."
2015-06-07 08:15:13,"Hordalandpoliti","Nordnes: Politi og ambulanse er på staden. Mannen fraktas til Haukeland Sjukehus. Uklart hendelelsesforløp."
2015-06-11 14:36:47,"oslopolitiops","Brannen er slukket. Opprettes sak."
2015-06-11 14:14:15,"oslopolitiops","Vi er på vei til Hallagerbakken skole hvor det brenner i en container."
2015-06-11 14:08:01,"oslopolitiops","Ferdig i Granfosstunnelen."
2015-06-11 14:07:00,"oslopolitiops","Den skadde er kjørt til legevakt. Politiet oppretter sak."
2015-06-11 13:37:38,"oslopolitiops","Vi har fått kontroll på hest og kjerre. Er en skadet person på stedet. Ambulanse underveis."
2015-06-11 13:35:18,"oslopolitiops","Vi står i Granfosstunnelen, østgående, i forbindelse med en kjøretøystans."
2015-06-11 13:30:52,"oslopolitiops","Vi er på Sognsvann for å få kontroll på en hest som løper løpsk."
2015-06-11 12:57:40,"oslopolitiops","tørrkok i en leilighet, ingen tilstede, vi åpner sak"
2015-06-11 12:51:10,"oslopolitiops","nødetatene på stedet, kan foreløpig ikke finne noen brann,"
2015-06-11 12:46:08,"oslopolitiops","Økernveien, melding om brann, nødetatene er underveis"
2015-06-11 12:35:52,"oslopolitiops","Majorstua, mann som tar bilder oppunder skjørtet på en kvinne, vi er på stedet, en mann pågrepet, kjøres arrest, anm."
2015-06-11 10:15:52,"oslopolitiops","Ikke meldt om personskade. Bilberging rekvirert"
2015-06-11 10:14:41,"oslopolitiops","Thorvald Meyers gate: Trafikkulykke - trikk og bil involvert. Nødetatene underveis"
2015-06-11 10:11:26,"oslopolitiops","Bilen er nå hentet ut av tunnelen"
2015-06-11 09:45:57,"oslopolitiops","Ingen personskade, kun materielle skader. Bilberging rekvirert"
2015-06-11 09:43:53,"oslopolitiops","Festningstunnelen, østgående: Bil med stans - står i venstre felt."
2015-06-11 09:38:50,"oslopolitiops","E6 inngående v/Ryen: Trafikkuhell - to personbiler og en lastebil involvert. Står i høyre felt, rett før lokket. Skaper en del kø"
2015-06-11 06:16:18,"oslopolitiops","Fører av mc, kjørt legevakten for videre sjekk. Veibanen ryddet og åpnet for trafikk igjen"
2015-06-11 05:50:23,"oslopolitiops","Trafikken flyter greit i høyre felt. Mc-fører blir sjekket av helsepersonell på stedet. Bilberging rekvirert."
2015-06-11 05:40:50,"oslopolitiops","Vålerengtunnelen, sydgående: Trafikkulykke - mc og bil involvert, rett etter tunnelutløpet. Mc-fører lettere skadet, men oppegående."
2015-06-11 02:42:18,"oslopolitiops","Ingen brann, men en svartbrent pizza. En person ses til av ambulanse etter å ha fått i seg litt røyk."
2015-06-11 02:23:56,"oslopolitiops","Dannevigsveien: Melding om røyklukt og en brannvarsler går. Nødetater på vei."
2015-06-11 01:24:27,"oslopolitiops","Youngstorget: Melding om slagsmål mellom flere personer. Vi er på stedet og har kontroll på 2 av de. Ingen personskade."
2015-06-10 22:04:10,"oslopolitiops","Det har brent i en duk hos en eldre dame. Denne er slukket og ingen evakuerte. Damen har fått i seg litt røyk og blir sett til av ambulanse."
2015-06-10 21:53:12,"oslopolitiops","Rugveien: Røykvarsler aktivisert og det lukter røyk. Nødetater på vei."
2015-06-10 21:25:07,"oslopolitiops","En kvinne funnet død. En person er pågrepet. Det pågår tekniske og taktiske undersøkelser på stedet. Voldsavsnittet vil uttale seg i morgen."
2015-06-10 20:52:28,"oslopolitiops","Karl Staaffs vei: En person funnet livløs i en leilighet. Politiet jobber på stedet. Omstendighetene er så langt uklare."
2015-06-10 15:20:26,"oslopolitiops","Festningstunnelen østgående løp: lastebil med motorstans. Bergingsbil på vei. Situasjonen skaper kø. Vi er på stedet."
2015-06-10 15:13:17,"oslopolitiops","Vålerengatunnelen nordgående løp: buss med motorstans. Bergingsbil på vei. Situasjonen skaper kø."
2015-06-10 14:27:35,"oslopolitiops","Vi er på stedet. Ingen alvorlig personskade. En del kø i Holmenkollveien som følge av ulykken."
2015-06-10 14:16:00,"oslopolitiops","Trafikkulykke, bil mot bil i Holmenkollveien x Dagaliveien. Alle nødetater på vei."
2015-06-10 12:48:35,"oslopolitiops","En person sjekkes av ambulanse, skal være lettere skadd."
2015-06-10 12:41:08,"oslopolitiops","Vi har fått melding om trafikkulykke i Tamburveien, Nydalen. Nødetater er på vei."
2015-06-10 11:49:32,"oslopolitiops","Fornærmede blir kjørt til legev. Mulig ribbeinsbrudd.."
2015-06-10 11:25:07,"oslopolitiops","Mannen er oppegående. Blør fra en arm"
2015-06-10 11:16:04,"oslopolitiops","Melding om trafikkulykke i Erich Mogensønsvei. Eldre mann påkjørt. Politi og amb. underveis."
2015-06-10 05:55:22,"oslopolitiops","Bilene er ute av tunnel, trafikken flyter fint igjen."
2015-06-10 05:53:02,"oslopolitiops","Festningstunnellen østgående, 3 biler i venstre felt. Ukjent årsak, vi er på vei."
2015-06-10 02:51:58,"oslopolitiops","Ca kl 0330 var det boliginnbrudd på Vettakollen. Vi brukte helikopter og hund i søket. 1 mann pågrepet ved Sognsvann ca 1 time senere"
2015-06-09 23:47:47,"oslopolitiops","På Akershusstranda har hundepatruljen pågrepet en mann som knuste en bilrute for å stjele"
2015-06-09 20:43:26,"oslopolitiops","Ingen gjerningspersoner funnet dessverre. Politiet oppretter sak."
2015-06-09 19:58:02,"oslopolitiops","Brannen er slukket. Politiet er på stedet og leter etter flere gjerningspersoner."
2015-06-09 19:31:53,"oslopolitiops","Det brenner i en papircontainer i Sverre Iversens vei. Trolig påtent. Politiet og brannvesenet er på vei."
2015-06-09 19:24:28,"oslopolitiops","En melder ringte og sa at han hadde sporet sin stjålne telefon til en gitt adresse. Politiet ringte på, og fant telefonen der. Sak oppklart."
2015-06-09 17:58:19,"oslopolitiops","Mannen er tilrette. Funnet på Bygdøy, i god behold og en smule bedugget."
2015-06-09 15:19:07,"oslopolitiops","Området mellom Filipstad og Bygdøy er veldig aktuelt. Ved observasjon av mannen ring 02800."
2015-06-09 15:17:25,"oslopolitiops","Politiet søket etter mann, ca 20 år, kort svart hår, skjegg, mørk treningsjakke, olabukse og en(1) blå joggesko med hvite striper(Adidas)."
2015-06-09 14:29:41,"oslopolitiops","Hele museet sjekket ut. Ingen brann. Sperringene opphevet."
2015-06-09 14:02:18,"oslopolitiops","Nødetatene har akkurat kommet frem til stedet. Normal drift på stedet, men vi sjekker nærmere. Sperringer i Huitfeldtsgt/ Henrik Ibsensgt."
2015-06-09 13:55:57,"oslopolitiops","Nødetatene er på vei til Arbins Gate 1, Ibsenmuseet. Melding om røykutvikling."
2015-06-11 13:39:14,"Rogalandops","Brannen var i søppel på utsiden av bygget. Tok videre fyr i kledningen i bygget. Raskt kontroll på stedet. Sak opprettet"
2015-06-11 12:42:49,"Rogalandops","SANDNES: Brann i bygning. Mindre omfang."
2015-06-11 12:31:40,"Rogalandops","Kontroll på mannen. Har skadet seg selv."
2015-06-11 11:08:29,"Rogalandops","Forhandlere fra politiet er i telefonisk kontakt med mannen."
2015-06-11 10:29:14,"Rogalandops","Foranledningen var at mannen skulle hentes for å transporteres ut av landet."
2015-06-11 10:07:49,"Rogalandops","Mannen har forskanset seg på et rom på Hå mottak."
2015-06-11 09:49:51,"Rogalandops","NÆRBØ: Mann truer politiet med kniv."
2015-06-11 09:28:14,"Rogalandops","FORUS: Kl. 1106: Brann i container. En uheldig kokk hadde kastet varm grillkull i containeren. Slukket."
2015-06-11 07:15:17,"Rogalandops","Ingen vil anmelde noe. Rus i bildet. En mann i 40 årene er bortvist fra stedet."
2015-06-11 07:10:16,"Rogalandops","SANDNES: I Holmavika har en patrulje pålagt campere å rydde opp etter seg. Fire utenlands registrerte biler stod på stedet."
2015-06-11 07:08:21,"Rogalandops","STAVANGER kl. 0845: Melding om to menn som slåss. En person er dyttet ned en trapp. Ingen personskade. Patr er på stedet."
2015-06-11 07:06:44,"Rogalandops","SANDNES: Ca 0745 kjørte en lastebil inn i jernbanebrua i Kvernelandsveien. Uvisst om det er skade på broen. Ikke sjekket av politiet enda."
2015-06-11 03:15:52,"Rogalandops","Ingen spesielle hendelser i løpet av natten."
2015-06-10 20:27:19,"Rogalandops","Bilen som var forlatt er tauet av taueselskap. Sak opprettet,"
2015-06-10 20:26:37,"Rogalandops","Forut for trafikkuhellet hadde nevnte bil foretatt en forbikjøring av en bil. Dunket da i sidespeilet til bilen som ble forbikjørt."
2015-06-10 20:14:28,"Rogalandops","Politiet er på stedet. Søker etter de to som var i bilen, en mann og en dame. Bilen som kjørte gjennom hekken er ikke meldt stjålet."
2015-06-10 19:47:37,"Rogalandops","2141.Hinna.Trafikkuhell. Melding om en bil som har krasjet kjørt/ gjennom en hekk. To personer har stukket fra bilen.  Politiet på vei"
2015-06-10 17:54:11,"Rogalandops","Rolig kveld i Rogaland pd"
2015-06-10 17:53:50,"Rogalandops","i besittelse av en mindre kniv. Beslaglagt. Sak opprettet."
2015-06-10 17:53:23,"Rogalandops","Stavanger sentrum. Naskeri, besittelse av kniv off. sted. Politiet ble tilkalt i forbindelse med et mindre naskeri. Ved sjekk var mann 29"
2015-06-10 11:36:42,"Rogalandops","Fornærmede ønsket ikke å anmelde forholdet."
2015-06-10 11:36:01,"Rogalandops","13:19 innkom melding om slagsmål mellom flere personer på Fiskepiren. Mann(44) måtte tilses av medisinsk personell for et kutt i pannen."
2015-06-10 11:33:59,"Rogalandops","12:30 i Stavanger ble kvinne (38) anmeldt etter at hun var i besittelse av reseptpliktige tabletter uten å kunne redegjøre rede for disse."
2015-06-10 08:40:11,"Rogalandops","10:40 Rolig start på dagen, ingen hendelser å melde."
2015-06-10 00:48:47,"Rogalandops","Kl 0244 Braut, Klepp. En mann 24 blir anmeldt for å ha kjørt bil uten gyldig førerkort."
2015-06-10 00:45:46,"Rogalandops","Kl 0200 Stavanger sentrum. En mann 27 bortvist fra sentrum etter å ha bråket på et utested."
2015-06-09 23:28:44,"Rogalandops","Kl 0120 Sandnes. En mann 27 anmeldt for å ha kjørt med tilhenger uten å ha førerkort for det."
2015-06-09 15:58:34,"Rogalandops","1750 Motorveien/Madlaveien, buss og personbil kollidert. Ingen melding om personskade, men trafikale problemer. Politiet på vei"
2015-06-09 06:59:52,"Rogalandops","Syklisten blir sendt til sykehus for kontroll. Bilfører får førerkort beslaglagt - ikke overholdt vikeplikt."
2015-06-09 06:19:07,"Rogalandops","Melding om trafikkulykke i Gamle Sokndalsvei i Egersund. Bil og syklist har kollidert. Nødetater på vei. Ukjent skadeomfang."
2015-06-09 04:34:52,"Rogalandops","Resultatløst søk etter gjerningsperson nr 2."
2015-06-09 03:29:32,"Rogalandops","funnet gjemt i samme område som 30-åringen ble funnet. Søk etter gjerningsperson 2 fortsetter."
2015-06-09 03:28:26,"Rogalandops","05:02 ble det utløst alarm på Japan Foto i Søregata. 2 personer observert i området. Kl 05;:24 ble mann (30) pågrepet på Sølvberget.Tyvegods"
2015-06-09 02:58:45,"Rogalandops","Rolig natt i politidistriktet. Kun melding om stjålet sort BMW i Klepp med regnr. BR54729, samt 2 tilfeller av kjøring uten gyldig førerkort"
2015-06-08 20:18:21,"Rogalandops","2130 Tjensvoll - fører av moped stoppet kjørende på en stjålet moped. Han mistenkes i tillegg for kjøring i ruspåvirket tilstand"
2015-06-08 20:16:19,"Rogalandops","2200 Tau Bil kjørte på sykelist. Ambulanse og politiet på stedet."
2015-06-08 19:51:12,"Rogalandops","2150 Ålgård - nødetatene ferdig på stedet og E39 åpnes for normal trafikk."
2015-06-08 18:59:22,"Rogalandops","2100 luftambulansen har landet. MC fører har smerte i nakke-rygg og arm. Trafikken omdirigeres. gjennom industriområdet."
2015-06-08 18:42:33,"Rogalandops","2039 Ålgård - E39 trafikkulykke MC kjørt i trailer. Nødetatene på vei."
2015-06-08 18:03:57,"Rogalandops","1740 Solbakk - to biler frontkolliderte. Ingen personskade. Førerkort til en av førerne beslaglagt."
2015-06-08 14:50:57,"Rogalandops","Kvernevik . hittet hund - en CHIHUAHUA  tatt vare på av Falck. Kontakt Politiet for opplysninger."
2015-06-08 10:38:05,"Rogalandops","Kollidert i rundkjøring på Braut. Mopedfører er kjørt til legevakt. Ikke førerkortbeslag."
2015-06-08 09:32:52,"Rogalandops","Riktig sted skal være FV 44 på Braut."
2015-06-08 09:29:33,"Rogalandops","Trafikkulykke på Kåsen, Bryne. Bil og moped er involvert. Nødetater på vei til stedet. Foreløpig ukjent skadeomfang."
2015-06-07 23:06:06,"Rogalandops","2330-0100  Fv 44 Gandal Fartskontroll Høyeste hastighet var 112 km/t i 80 km/t sone.  Ett førerkortbeslag fordi fører fikk for mange prikker"
2015-06-07 18:36:21,"Rogalandops","19:56 - Håvgn v/ Nærbø - meld fra vitne om åpenbart beruset bilfører, skal ha bl. a kjørt borti steingj: Patr p std. Utl statsb pågr. Blodpr"
2015-06-07 17:10:28,"Rogalandops","Vedr blind vold v/Konserthuset Stvgr natt til sønd. 0005; 
Saken er alv; Mann (68) innl. SUS m kraniebrudd. Sikt mist f misb av anab st"
2015-06-07 08:54:29,"Rogalandops","Søket i Egersund fortsetter. Det er møtt 13 stk fra frivillige organisasjoner, veldig mange venner og kjente og dykkere fra brannvesenet."
2015-06-07 03:40:40,"Rogalandops","04:20 - Sandnes sentrum - mann i 40-årene anmeld av patr. etter Sexkjøpsloven."
2015-06-07 02:03:47,"Rogalandops","Natt til søndag; En rekke klager på festestøy / høy musikk fra privatboliger i distriktet. 
Patruljer på stedet i de fleste av disse forh."
2015-06-11 14:29:40,"polititroms","UP har avholdt fartskontroll i Tromsø. 11 f.f. for fartsovertredelse og 1 f.f for farlig forbikjøring.Høyeste hastighet 115 km/t i 80 sone."
2015-06-11 07:59:16,"polititroms","I løpet av natten er det stjålet en sort volkswagen Golf - ZH43555.  Bilen har påklistret en Coca Cola reklame. Stålet fra Tromsø"
2015-06-11 06:37:33,"polititroms","Politiet i Tromsø har hatt trafikkontroll v/Sorgenfri barnehage - 30 kontrollerte, ingen reaksjoner :)"
2015-06-10 22:10:25,"polititroms","E6 Slettnes/Storfjord: UP har gjennomført fartskontroll i 80 sone. 12 FF utstedt - høyeste fart 100 km/t."
2015-06-10 13:43:06,"polititroms","UP har beslaglagt førerkortet til en 26 års gammel mann. Forholdet skjedde på E 8 - Lavangsdalen. 116 km/t i 80 sone."
2015-06-09 23:49:10,"polititroms","Tromsø: UP avholdt fartskontroll på FV 53 i Tønsvik i 60-sonen i går kveld. 11 forenklede forelegg ble utstedt. Høyeste fart var 80 km/t."
2015-06-08 11:25:08,"polititroms","Håkøybotn: Hvit gummibåt, Loadstar, funnet, Suzuki påhengsmotor."
2015-06-07 22:15:36,"polititroms","UP har i løpet av kvelden avholdt fartskontroll på E6 i Balsfjord. 20 f.f. Høyeste hastighet 75 km i 60 sone."
2015-06-07 04:30:01,"polititroms","En 35 års gammel mann har erkjent bruk av narkotika. Forholdet skjedde kl. 0255 på Lenangsøyra. Sak er opprettet."
2015-06-07 04:26:48,"polititroms","To personer er pågrepet mistenkt for promillekjøring. En 22 års gammel dame på Laksvatn og en 19 års gammel soldat ble pågrepet på Skiold"
2015-06-07 04:20:49,"polititroms","En 64 års gammel mann vil bli anmeldt etter at han har røykt når han lå i senga hvor etter det har tatt fyr i sengteppet."
2015-06-07 04:18:06,"polititroms","Kl. 0400 ble 2 menn anholdt i Tromsø sentrum etter at de hadde sparket og slått en dame. Det er opprettet sak på episoden."
2015-06-07 04:15:57,"polititroms","I Tromsø sentrum ble en 31 års gammel mann innsatt i arrest og anmeldt for ikke å etterkomme pålegg fra politiet. Forholdet skjedd kl.0200"
2015-06-06 15:43:31,"polititroms","@polititroms Ingen personskader, brannvesenet har kontroll og politiet gjør undersøkelser på stedet."
2015-06-06 15:03:24,"polititroms","MÅLSELV: Brann i anneks i Målselv Fjellandsby. Nødetater på vei."
2015-06-05 19:41:48,"polititroms","TROMSØ:UP hadde fartskontroll på Ringvassøya.Mann i 20 åra ble målt til 133 km/t i 80 sone.Førerkortet beslaglagt og sak opprettes."
2015-06-05 13:19:40,"polititroms","@polititroms Mann i 20 åra har fått hånda i klem i en betongvisp.Mannen er sendt til UNN.Saken etterforskes videre ved Tromsø politistasjon."
2015-06-05 12:20:01,"polititroms","Kvaløya: Arbeidsuhell, person fått en hånd/arm inn i en maskin. Nødetatene på vei."
2015-06-04 18:36:48,"polititroms","Skjervøy og Nordreisa:Trafikkontroll gjennomført av UP. 71 kontrollerte bilførere. Fire forelegg fart. en for mobil, en anm. m/f.kortbeslag."
2015-06-04 17:13:50,"polititroms","Mallangen: Hamnvåg. En personbil har kjørt av vegen ved Hamnvågbukta. To personer i bilen. Lettere skadd."
2015-06-04 16:47:39,"polititroms","Nordkjsbotn: fartskontroll gjennomført av UP. 24 bilførere ilagt forenklet forelegg."
2015-06-03 23:11:12,"polititroms","Kvænangen: UP utførte fartskontroll i går kveld v/ E-6 Alteidet i 60-sonen. 12 forenklede forelegg utstedt. Høyeste fart var 79 km/t."
2015-06-03 19:40:09,"polititroms","Brannen på Finnsnes er slokket. To personer kjørt med ambulanse til legevakta. Ukjent skadeomfang."
2015-06-03 19:37:54,"polititroms","Finnsnes - Melding om brann i en enebolig på Finnsnes. Nødetatene er på stedet."
2015-06-03 13:34:04,"polititroms","Tromsøysundtunnelen: tunnelen er åpen for trafikk."
2015-06-03 12:36:18,"polititroms","Tromsø: Tromsøysundtunellen mot fastlandet stengt midlertidig pga motorstopp på en lastebil."
2015-06-03 10:29:56,"polititroms","Eier ringte og hunden blir gjenforent med sin herre."
2015-06-03 10:24:16,"polititroms","Hunden blir overtatt av hundegruppa i Dyrebeskyttelsen Tromsø. Kontakt dit kan videreformidles fra politiet."
2015-06-03 10:11:08,"polititroms","Tromsø: en løs rottweiler er tatt i forvaring av oss, funnet på Bjerkaker skole. Er det noen som savner denne? Ring 02800"
2015-06-02 15:39:44,"polititroms","Gasslekasje v/ UNN. Det meldes fra politiets innsatsleder at gasslekasje fra tanken nå var stanset. Mer info kommer etterhvert."
2015-06-02 15:19:48,"polititroms","I forb med spregningsarbeidet v/ UNN så er det blitt lekkasje i en en nitrogentank. Tanken ligger ved MH bygget. Brann og politiet på stedet"
2015-06-02 13:35:20,"polititroms","Grøtfjord / Tromvik. Personen som var invollvert i trafikkulykken er tatt ut fra kjøretøyet, flydd til UNN for videre behandling"
2015-06-02 12:26:40,"polititroms","Grøtfjord/Tromvika: Alvorlig trafikkulykke. En bil kjørt utenfor vegen, en person alvorlig skadet, nødetatene på vei."
2015-05-31 20:49:53,"polititroms","I tillegg ble det tatt beslag i et våpen som ikke var oppbevart ihht forskriftene."
2015-05-31 20:49:03,"polititroms","Vannøya: vi er på stedet og tar blodprøve av en mannsperson som er mistenkt for promillekjøring."
2015-05-31 20:25:12,"polititroms","Olderdalen: UP har beslaglagt et førerkort til en fører som ble knepet i 86 km/t i 60 sonen. Dette i tillegg til 12 FF for hastighet."
2015-05-31 16:10:03,"polititroms","Bilen hentet og trafikken går som normalt."
2015-05-31 15:39:32,"polititroms","Tromsø: bilstans på Tromsøbrua. Vi er på veg for løse floken og bilbergning ankommer straks."
2015-05-31 03:42:13,"polititroms","../2 bilføreren, mann 20 år, er bragt til legevakta for undersøkelse. Han er mistenkt for å ha kjørt i alkoholpåvirket tilstand."
